No.     Time           Source                Destination           Protocol Length Info
      1 0.000000000    10.0.5.11             10.0.5.100            TCP      74     38898→23 [SYN] Seq=0 Win=29200 Len=0 MSS=1460 SACK_PERM=1 TSval=4138052 TSecr=0 WS=128

Frame 1: 74 bytes on wire (592 bits), 74 bytes captured (592 bits) on interface 0
Ethernet II, Src: CadmusCo_f0:45:54 (08:00:27:f0:45:54), Dst: 3com_03:04:05 (00:01:02:03:04:05)
Internet Protocol Version 4, Src: 10.0.5.11 (10.0.5.11), Dst: 10.0.5.100 (10.0.5.100)
Transmission Control Protocol, Src Port: 38898 (38898), Dst Port: 23 (23), Seq: 0, Len: 0

No.     Time           Source                Destination           Protocol Length Info
      2 0.998584000    10.0.5.11             10.0.5.100            TCP      74     [TCP Retransmission] 38898→23 [SYN] Seq=0 Win=29200 Len=0 MSS=1460 SACK_PERM=1 TSval=4138302 TSecr=0 WS=128

Frame 2: 74 bytes on wire (592 bits), 74 bytes captured (592 bits) on interface 0
Ethernet II, Src: CadmusCo_f0:45:54 (08:00:27:f0:45:54), Dst: 3com_03:04:05 (00:01:02:03:04:05)
Internet Protocol Version 4, Src: 10.0.5.11 (10.0.5.11), Dst: 10.0.5.100 (10.0.5.100)
Transmission Control Protocol, Src Port: 38898 (38898), Dst Port: 23 (23), Seq: 0, Len: 0

No.     Time           Source                Destination           Protocol Length Info
      3 3.002999000    10.0.5.11             10.0.5.100            TCP      74     [TCP Retransmission] 38898→23 [SYN] Seq=0 Win=29200 Len=0 MSS=1460 SACK_PERM=1 TSval=4138803 TSecr=0 WS=128

Frame 3: 74 bytes on wire (592 bits), 74 bytes captured (592 bits) on interface 0
Ethernet II, Src: CadmusCo_f0:45:54 (08:00:27:f0:45:54), Dst: 3com_03:04:05 (00:01:02:03:04:05)
Internet Protocol Version 4, Src: 10.0.5.11 (10.0.5.11), Dst: 10.0.5.100 (10.0.5.100)
Transmission Control Protocol, Src Port: 38898 (38898), Dst Port: 23 (23), Seq: 0, Len: 0

No.     Time           Source                Destination           Protocol Length Info
      4 7.006590000    10.0.5.11             10.0.5.100            TCP      74     [TCP Retransmission] 38898→23 [SYN] Seq=0 Win=29200 Len=0 MSS=1460 SACK_PERM=1 TSval=4139804 TSecr=0 WS=128

Frame 4: 74 bytes on wire (592 bits), 74 bytes captured (592 bits) on interface 0
Ethernet II, Src: CadmusCo_f0:45:54 (08:00:27:f0:45:54), Dst: 3com_03:04:05 (00:01:02:03:04:05)
Internet Protocol Version 4, Src: 10.0.5.11 (10.0.5.11), Dst: 10.0.5.100 (10.0.5.100)
Transmission Control Protocol, Src Port: 38898 (38898), Dst Port: 23 (23), Seq: 0, Len: 0

No.     Time           Source                Destination           Protocol Length Info
      5 15.022575000   10.0.5.11             10.0.5.100            TCP      74     [TCP Retransmission] 38898→23 [SYN] Seq=0 Win=29200 Len=0 MSS=1460 SACK_PERM=1 TSval=4141808 TSecr=0 WS=128

Frame 5: 74 bytes on wire (592 bits), 74 bytes captured (592 bits) on interface 0
Ethernet II, Src: CadmusCo_f0:45:54 (08:00:27:f0:45:54), Dst: 3com_03:04:05 (00:01:02:03:04:05)
Internet Protocol Version 4, Src: 10.0.5.11 (10.0.5.11), Dst: 10.0.5.100 (10.0.5.100)
Transmission Control Protocol, Src Port: 38898 (38898), Dst Port: 23 (23), Seq: 0, Len: 0

No.     Time           Source                Destination           Protocol Length Info
      6 31.054265000   10.0.5.11             10.0.5.100            TCP      74     [TCP Retransmission] 38898→23 [SYN] Seq=0 Win=29200 Len=0 MSS=1460 SACK_PERM=1 TSval=4145816 TSecr=0 WS=128

Frame 6: 74 bytes on wire (592 bits), 74 bytes captured (592 bits) on interface 0
Ethernet II, Src: CadmusCo_f0:45:54 (08:00:27:f0:45:54), Dst: 3com_03:04:05 (00:01:02:03:04:05)
Internet Protocol Version 4, Src: 10.0.5.11 (10.0.5.11), Dst: 10.0.5.100 (10.0.5.100)
Transmission Control Protocol, Src Port: 38898 (38898), Dst Port: 23 (23), Seq: 0, Len: 0

No.     Time           Source                Destination           Protocol Length Info
      7 63.085888000   10.0.5.11             10.0.5.100            TCP      74     [TCP Retransmission] 38898→23 [SYN] Seq=0 Win=29200 Len=0 MSS=1460 SACK_PERM=1 TSval=4153824 TSecr=0 WS=128

Frame 7: 74 bytes on wire (592 bits), 74 bytes captured (592 bits) on interface 0
Ethernet II, Src: CadmusCo_f0:45:54 (08:00:27:f0:45:54), Dst: 3com_03:04:05 (00:01:02:03:04:05)
Internet Protocol Version 4, Src: 10.0.5.11 (10.0.5.11), Dst: 10.0.5.100 (10.0.5.100)
Transmission Control Protocol, Src Port: 38898 (38898), Dst Port: 23 (23), Seq: 0, Len: 0
