No.     Time           Source                Destination           Protocol Length Info
      1 0.000000000    10.0.5.11             10.0.5.22             TCP      74     40915→7 [SYN] Seq=0 Win=29200 Len=0 MSS=1460 SACK_PERM=1 TSval=706640 TSecr=0 WS=128

Frame 1: 74 bytes on wire (592 bits), 74 bytes captured (592 bits) on interface 0
Ethernet II, Src: CadmusCo_f0:45:54 (08:00:27:f0:45:54), Dst: CadmusCo_d3:f3:47 (08:00:27:d3:f3:47)
Internet Protocol Version 4, Src: 10.0.5.11 (10.0.5.11), Dst: 10.0.5.22 (10.0.5.22)
Transmission Control Protocol, Src Port: 40915 (40915), Dst Port: 7 (7), Seq: 0, Len: 0

No.     Time           Source                Destination           Protocol Length Info
      2 0.000500000    10.0.5.22             10.0.5.11             TCP      74     7→40915 [SYN, ACK] Seq=0 Ack=1 Win=28960 Len=0 MSS=1460 SACK_PERM=1 TSval=707207 TSecr=706640 WS=128

Frame 2: 74 bytes on wire (592 bits), 74 bytes captured (592 bits) on interface 0
Ethernet II, Src: CadmusCo_d3:f3:47 (08:00:27:d3:f3:47), Dst: CadmusCo_f0:45:54 (08:00:27:f0:45:54)
Internet Protocol Version 4, Src: 10.0.5.22 (10.0.5.22), Dst: 10.0.5.11 (10.0.5.11)
Transmission Control Protocol, Src Port: 7 (7), Dst Port: 40915 (40915), Seq: 0, Ack: 1, Len: 0

No.     Time           Source                Destination           Protocol Length Info
      3 0.000999000    10.0.5.11             10.0.5.22             TCP      66     40915→7 [ACK] Seq=1 Ack=1 Win=29312 Len=0 TSval=706640 TSecr=707207

Frame 3: 66 bytes on wire (528 bits), 66 bytes captured (528 bits) on interface 0
Ethernet II, Src: CadmusCo_f0:45:54 (08:00:27:f0:45:54), Dst: CadmusCo_d3:f3:47 (08:00:27:d3:f3:47)
Internet Protocol Version 4, Src: 10.0.5.11 (10.0.5.11), Dst: 10.0.5.22 (10.0.5.22)
Transmission Control Protocol, Src Port: 40915 (40915), Dst Port: 7 (7), Seq: 1, Ack: 1, Len: 0

No.     Time           Source                Destination           Protocol Length Info
      4 0.005503000    10.0.5.11             10.0.5.22             ECHO     322    Request

Frame 4: 322 bytes on wire (2576 bits), 322 bytes captured (2576 bits) on interface 0
Ethernet II, Src: CadmusCo_f0:45:54 (08:00:27:f0:45:54), Dst: CadmusCo_d3:f3:47 (08:00:27:d3:f3:47)
Internet Protocol Version 4, Src: 10.0.5.11 (10.0.5.11), Dst: 10.0.5.22 (10.0.5.22)
Transmission Control Protocol, Src Port: 40915 (40915), Dst Port: 7 (7), Seq: 1, Ack: 1, Len: 256
Echo

No.     Time           Source                Destination           Protocol Length Info
      5 0.006025000    10.0.5.22             10.0.5.11             TCP      66     7→40915 [ACK] Seq=1 Ack=257 Win=30080 Len=0 TSval=707208 TSecr=706640

Frame 5: 66 bytes on wire (528 bits), 66 bytes captured (528 bits) on interface 0
Ethernet II, Src: CadmusCo_d3:f3:47 (08:00:27:d3:f3:47), Dst: CadmusCo_f0:45:54 (08:00:27:f0:45:54)
Internet Protocol Version 4, Src: 10.0.5.22 (10.0.5.22), Dst: 10.0.5.11 (10.0.5.11)
Transmission Control Protocol, Src Port: 7 (7), Dst Port: 40915 (40915), Seq: 1, Ack: 257, Len: 0

No.     Time           Source                Destination           Protocol Length Info
      6 0.006503000    10.0.5.22             10.0.5.11             ECHO     322    Response

Frame 6: 322 bytes on wire (2576 bits), 322 bytes captured (2576 bits) on interface 0
Ethernet II, Src: CadmusCo_d3:f3:47 (08:00:27:d3:f3:47), Dst: CadmusCo_f0:45:54 (08:00:27:f0:45:54)
Internet Protocol Version 4, Src: 10.0.5.22 (10.0.5.22), Dst: 10.0.5.11 (10.0.5.11)
Transmission Control Protocol, Src Port: 7 (7), Dst Port: 40915 (40915), Seq: 1, Ack: 257, Len: 256
Echo

No.     Time           Source                Destination           Protocol Length Info
      7 0.006503000    10.0.5.11             10.0.5.22             TCP      66     40915→7 [ACK] Seq=257 Ack=257 Win=30336 Len=0 TSval=706641 TSecr=707208

Frame 7: 66 bytes on wire (528 bits), 66 bytes captured (528 bits) on interface 0
Ethernet II, Src: CadmusCo_f0:45:54 (08:00:27:f0:45:54), Dst: CadmusCo_d3:f3:47 (08:00:27:d3:f3:47)
Internet Protocol Version 4, Src: 10.0.5.11 (10.0.5.11), Dst: 10.0.5.22 (10.0.5.22)
Transmission Control Protocol, Src Port: 40915 (40915), Dst Port: 7 (7), Seq: 257, Ack: 257, Len: 0

No.     Time           Source                Destination           Protocol Length Info
      8 0.008489000    10.0.5.11             10.0.5.22             TCP      66     40915→7 [FIN, ACK] Seq=257 Ack=257 Win=30336 Len=0 TSval=706642 TSecr=707208

Frame 8: 66 bytes on wire (528 bits), 66 bytes captured (528 bits) on interface 0
Ethernet II, Src: CadmusCo_f0:45:54 (08:00:27:f0:45:54), Dst: CadmusCo_d3:f3:47 (08:00:27:d3:f3:47)
Internet Protocol Version 4, Src: 10.0.5.11 (10.0.5.11), Dst: 10.0.5.22 (10.0.5.22)
Transmission Control Protocol, Src Port: 40915 (40915), Dst Port: 7 (7), Seq: 257, Ack: 257, Len: 0

No.     Time           Source                Destination           Protocol Length Info
      9 0.009466000    10.0.5.22             10.0.5.11             TCP      66     7→40915 [FIN, ACK] Seq=257 Ack=258 Win=30080 Len=0 TSval=707209 TSecr=706642

Frame 9: 66 bytes on wire (528 bits), 66 bytes captured (528 bits) on interface 0
Ethernet II, Src: CadmusCo_d3:f3:47 (08:00:27:d3:f3:47), Dst: CadmusCo_f0:45:54 (08:00:27:f0:45:54)
Internet Protocol Version 4, Src: 10.0.5.22 (10.0.5.22), Dst: 10.0.5.11 (10.0.5.11)
Transmission Control Protocol, Src Port: 7 (7), Dst Port: 40915 (40915), Seq: 257, Ack: 258, Len: 0

No.     Time           Source                Destination           Protocol Length Info
     10 0.010441000    10.0.5.11             10.0.5.22             TCP      66     40915→7 [ACK] Seq=258 Ack=258 Win=30336 Len=0 TSval=706642 TSecr=707209

Frame 10: 66 bytes on wire (528 bits), 66 bytes captured (528 bits) on interface 0
Ethernet II, Src: CadmusCo_f0:45:54 (08:00:27:f0:45:54), Dst: CadmusCo_d3:f3:47 (08:00:27:d3:f3:47)
Internet Protocol Version 4, Src: 10.0.5.11 (10.0.5.11), Dst: 10.0.5.22 (10.0.5.22)
Transmission Control Protocol, Src Port: 40915 (40915), Dst Port: 7 (7), Seq: 258, Ack: 258, Len: 0

No.     Time           Source                Destination           Protocol Length Info
     11 5.010828000    CadmusCo_d3:f3:47     CadmusCo_f0:45:54     ARP      60     Who has 10.0.5.11?  Tell 10.0.5.22

Frame 11: 60 bytes on wire (480 bits), 60 bytes captured (480 bits) on interface 0
Ethernet II, Src: CadmusCo_d3:f3:47 (08:00:27:d3:f3:47), Dst: CadmusCo_f0:45:54 (08:00:27:f0:45:54)
Address Resolution Protocol (request)

No.     Time           Source                Destination           Protocol Length Info
     12 5.011791000    CadmusCo_f0:45:54     CadmusCo_d3:f3:47     ARP      60     10.0.5.11 is at 08:00:27:f0:45:54

Frame 12: 60 bytes on wire (480 bits), 60 bytes captured (480 bits) on interface 0
Ethernet II, Src: CadmusCo_f0:45:54 (08:00:27:f0:45:54), Dst: CadmusCo_d3:f3:47 (08:00:27:d3:f3:47)
Address Resolution Protocol (reply)
