No.     Time           Source                Destination           Protocol Length Info
      1 0.000000000    10.0.1.11             10.0.2.22             TCP      74     54300→7 [SYN] Seq=0 Win=29200 Len=0 MSS=1460 SACK_PERM=1 TSval=2223390 TSecr=0 WS=128

Frame 1: 74 bytes on wire (592 bits), 74 bytes captured (592 bits) on interface 0
Ethernet II, Src: CadmusCo_99:78:0c (08:00:27:99:78:0c), Dst: CadmusCo_9c:1b:03 (08:00:27:9c:1b:03)
Internet Protocol Version 4, Src: 10.0.1.11 (10.0.1.11), Dst: 10.0.2.22 (10.0.2.22)
Transmission Control Protocol, Src Port: 54300 (54300), Dst Port: 7 (7), Seq: 0, Len: 0

No.     Time           Source                Destination           Protocol Length Info
      2 0.001952000    10.0.2.22             10.0.1.11             TCP      74     7→54300 [SYN, ACK] Seq=0 Ack=1 Win=8960 Len=0 MSS=460 SACK_PERM=1 TSval=2224732 TSecr=2223390 WS=128

Frame 2: 74 bytes on wire (592 bits), 74 bytes captured (592 bits) on interface 0
Ethernet II, Src: CadmusCo_9c:1b:03 (08:00:27:9c:1b:03), Dst: CadmusCo_99:78:0c (08:00:27:99:78:0c)
Internet Protocol Version 4, Src: 10.0.2.22 (10.0.2.22), Dst: 10.0.1.11 (10.0.1.11)
Transmission Control Protocol, Src Port: 7 (7), Dst Port: 54300 (54300), Seq: 0, Ack: 1, Len: 0

No.     Time           Source                Destination           Protocol Length Info
      3 0.003942000    10.0.1.11             10.0.2.22             TCP      66     54300→7 [ACK] Seq=1 Ack=1 Win=29312 Len=0 TSval=2223390 TSecr=2224732

Frame 3: 66 bytes on wire (528 bits), 66 bytes captured (528 bits) on interface 0
Ethernet II, Src: CadmusCo_99:78:0c (08:00:27:99:78:0c), Dst: CadmusCo_9c:1b:03 (08:00:27:9c:1b:03)
Internet Protocol Version 4, Src: 10.0.1.11 (10.0.1.11), Dst: 10.0.2.22 (10.0.2.22)
Transmission Control Protocol, Src Port: 54300 (54300), Dst Port: 7 (7), Seq: 1, Ack: 1, Len: 0

No.     Time           Source                Destination           Protocol Length Info
      4 0.006444000    10.0.1.11             10.0.2.22             ECHO     514    Request

Frame 4: 514 bytes on wire (4112 bits), 514 bytes captured (4112 bits) on interface 0
Ethernet II, Src: CadmusCo_99:78:0c (08:00:27:99:78:0c), Dst: CadmusCo_9c:1b:03 (08:00:27:9c:1b:03)
Internet Protocol Version 4, Src: 10.0.1.11 (10.0.1.11), Dst: 10.0.2.22 (10.0.2.22)
Transmission Control Protocol, Src Port: 54300 (54300), Dst Port: 7 (7), Seq: 1, Ack: 1, Len: 448
Echo

No.     Time           Source                Destination           Protocol Length Info
      5 0.006943000    10.0.1.11             10.0.2.22             ECHO     514    Request

Frame 5: 514 bytes on wire (4112 bits), 514 bytes captured (4112 bits) on interface 0
Ethernet II, Src: CadmusCo_99:78:0c (08:00:27:99:78:0c), Dst: CadmusCo_9c:1b:03 (08:00:27:9c:1b:03)
Internet Protocol Version 4, Src: 10.0.1.11 (10.0.1.11), Dst: 10.0.2.22 (10.0.2.22)
Transmission Control Protocol, Src Port: 54300 (54300), Dst Port: 7 (7), Seq: 449, Ack: 1, Len: 448
Echo

No.     Time           Source                Destination           Protocol Length Info
      6 0.006943000    10.0.1.11             10.0.2.22             ECHO     194    Request

Frame 6: 194 bytes on wire (1552 bits), 194 bytes captured (1552 bits) on interface 0
Ethernet II, Src: CadmusCo_99:78:0c (08:00:27:99:78:0c), Dst: CadmusCo_9c:1b:03 (08:00:27:9c:1b:03)
Internet Protocol Version 4, Src: 10.0.1.11 (10.0.1.11), Dst: 10.0.2.22 (10.0.2.22)
Transmission Control Protocol, Src Port: 54300 (54300), Dst Port: 7 (7), Seq: 897, Ack: 1, Len: 128
Echo

No.     Time           Source                Destination           Protocol Length Info
      7 0.008444000    10.0.2.22             10.0.1.11             TCP      66     7→54300 [ACK] Seq=1 Ack=449 Win=9856 Len=0 TSval=2224734 TSecr=2223391

Frame 7: 66 bytes on wire (528 bits), 66 bytes captured (528 bits) on interface 0
Ethernet II, Src: CadmusCo_9c:1b:03 (08:00:27:9c:1b:03), Dst: CadmusCo_99:78:0c (08:00:27:99:78:0c)
Internet Protocol Version 4, Src: 10.0.2.22 (10.0.2.22), Dst: 10.0.1.11 (10.0.1.11)
Transmission Control Protocol, Src Port: 7 (7), Dst Port: 54300 (54300), Seq: 1, Ack: 449, Len: 0

No.     Time           Source                Destination           Protocol Length Info
      8 0.008944000    10.0.2.22             10.0.1.11             ECHO     514    Response

Frame 8: 514 bytes on wire (4112 bits), 514 bytes captured (4112 bits) on interface 0
Ethernet II, Src: CadmusCo_9c:1b:03 (08:00:27:9c:1b:03), Dst: CadmusCo_99:78:0c (08:00:27:99:78:0c)
Internet Protocol Version 4, Src: 10.0.2.22 (10.0.2.22), Dst: 10.0.1.11 (10.0.1.11)
Transmission Control Protocol, Src Port: 7 (7), Dst Port: 54300 (54300), Seq: 1, Ack: 449, Len: 448
Echo

No.     Time           Source                Destination           Protocol Length Info
      9 0.009445000    10.0.2.22             10.0.1.11             ECHO     514    Response

Frame 9: 514 bytes on wire (4112 bits), 514 bytes captured (4112 bits) on interface 0
Ethernet II, Src: CadmusCo_9c:1b:03 (08:00:27:9c:1b:03), Dst: CadmusCo_99:78:0c (08:00:27:99:78:0c)
Internet Protocol Version 4, Src: 10.0.2.22 (10.0.2.22), Dst: 10.0.1.11 (10.0.1.11)
Transmission Control Protocol, Src Port: 7 (7), Dst Port: 54300 (54300), Seq: 449, Ack: 897, Len: 448
Echo

No.     Time           Source                Destination           Protocol Length Info
     10 0.009445000    10.0.1.11             10.0.2.22             TCP      66     54300→7 [ACK] Seq=1025 Ack=449 Win=30208 Len=0 TSval=2223392 TSecr=2224734

Frame 10: 66 bytes on wire (528 bits), 66 bytes captured (528 bits) on interface 0
Ethernet II, Src: CadmusCo_99:78:0c (08:00:27:99:78:0c), Dst: CadmusCo_9c:1b:03 (08:00:27:9c:1b:03)
Internet Protocol Version 4, Src: 10.0.1.11 (10.0.1.11), Dst: 10.0.2.22 (10.0.2.22)
Transmission Control Protocol, Src Port: 54300 (54300), Dst Port: 7 (7), Seq: 1025, Ack: 449, Len: 0

No.     Time           Source                Destination           Protocol Length Info
     11 0.009945000    10.0.2.22             10.0.1.11             ECHO     194    Response

Frame 11: 194 bytes on wire (1552 bits), 194 bytes captured (1552 bits) on interface 0
Ethernet II, Src: CadmusCo_9c:1b:03 (08:00:27:9c:1b:03), Dst: CadmusCo_99:78:0c (08:00:27:99:78:0c)
Internet Protocol Version 4, Src: 10.0.2.22 (10.0.2.22), Dst: 10.0.1.11 (10.0.1.11)
Transmission Control Protocol, Src Port: 7 (7), Dst Port: 54300 (54300), Seq: 897, Ack: 1025, Len: 128
Echo

No.     Time           Source                Destination           Protocol Length Info
     12 0.009945000    10.0.1.11             10.0.2.22             TCP      66     54300→7 [ACK] Seq=1025 Ack=897 Win=31104 Len=0 TSval=2223392 TSecr=2224734

Frame 12: 66 bytes on wire (528 bits), 66 bytes captured (528 bits) on interface 0
Ethernet II, Src: CadmusCo_99:78:0c (08:00:27:99:78:0c), Dst: CadmusCo_9c:1b:03 (08:00:27:9c:1b:03)
Internet Protocol Version 4, Src: 10.0.1.11 (10.0.1.11), Dst: 10.0.2.22 (10.0.2.22)
Transmission Control Protocol, Src Port: 54300 (54300), Dst Port: 7 (7), Seq: 1025, Ack: 897, Len: 0

No.     Time           Source                Destination           Protocol Length Info
     13 0.010445000    10.0.1.11             10.0.2.22             TCP      66     54300→7 [ACK] Seq=1025 Ack=1025 Win=32000 Len=0 TSval=2223392 TSecr=2224734

Frame 13: 66 bytes on wire (528 bits), 66 bytes captured (528 bits) on interface 0
Ethernet II, Src: CadmusCo_99:78:0c (08:00:27:99:78:0c), Dst: CadmusCo_9c:1b:03 (08:00:27:9c:1b:03)
Internet Protocol Version 4, Src: 10.0.1.11 (10.0.1.11), Dst: 10.0.2.22 (10.0.2.22)
Transmission Control Protocol, Src Port: 54300 (54300), Dst Port: 7 (7), Seq: 1025, Ack: 1025, Len: 0

No.     Time           Source                Destination           Protocol Length Info
     14 0.011946000    10.0.1.11             10.0.2.22             TCP      66     54300→7 [FIN, ACK] Seq=1025 Ack=1025 Win=32000 Len=0 TSval=2223393 TSecr=2224734

Frame 14: 66 bytes on wire (528 bits), 66 bytes captured (528 bits) on interface 0
Ethernet II, Src: CadmusCo_99:78:0c (08:00:27:99:78:0c), Dst: CadmusCo_9c:1b:03 (08:00:27:9c:1b:03)
Internet Protocol Version 4, Src: 10.0.1.11 (10.0.1.11), Dst: 10.0.2.22 (10.0.2.22)
Transmission Control Protocol, Src Port: 54300 (54300), Dst Port: 7 (7), Seq: 1025, Ack: 1025, Len: 0

No.     Time           Source                Destination           Protocol Length Info
     15 0.015452000    10.0.2.22             10.0.1.11             TCP      66     7→54300 [FIN, ACK] Seq=1025 Ack=1026 Win=11648 Len=0 TSval=2224736 TSecr=2223393

Frame 15: 66 bytes on wire (528 bits), 66 bytes captured (528 bits) on interface 0
Ethernet II, Src: CadmusCo_9c:1b:03 (08:00:27:9c:1b:03), Dst: CadmusCo_99:78:0c (08:00:27:99:78:0c)
Internet Protocol Version 4, Src: 10.0.2.22 (10.0.2.22), Dst: 10.0.1.11 (10.0.1.11)
Transmission Control Protocol, Src Port: 7 (7), Dst Port: 54300 (54300), Seq: 1025, Ack: 1026, Len: 0

No.     Time           Source                Destination           Protocol Length Info
     16 0.015950000    10.0.1.11             10.0.2.22             TCP      66     54300→7 [ACK] Seq=1026 Ack=1026 Win=32000 Len=0 TSval=2223394 TSecr=2224736

Frame 16: 66 bytes on wire (528 bits), 66 bytes captured (528 bits) on interface 0
Ethernet II, Src: CadmusCo_99:78:0c (08:00:27:99:78:0c), Dst: CadmusCo_9c:1b:03 (08:00:27:9c:1b:03)
Internet Protocol Version 4, Src: 10.0.1.11 (10.0.1.11), Dst: 10.0.2.22 (10.0.2.22)
Transmission Control Protocol, Src Port: 54300 (54300), Dst Port: 7 (7), Seq: 1026, Ack: 1026, Len: 0

No.     Time           Source                Destination           Protocol Length Info
     17 5.017148000    CadmusCo_9c:1b:03     CadmusCo_99:78:0c     ARP      60     Who has 10.0.1.11?  Tell 10.0.1.33

Frame 17: 60 bytes on wire (480 bits), 60 bytes captured (480 bits) on interface 0
Ethernet II, Src: CadmusCo_9c:1b:03 (08:00:27:9c:1b:03), Dst: CadmusCo_99:78:0c (08:00:27:99:78:0c)
Address Resolution Protocol (request)

No.     Time           Source                Destination           Protocol Length Info
     18 5.017648000    CadmusCo_99:78:0c     CadmusCo_9c:1b:03     ARP      60     10.0.1.11 is at 08:00:27:99:78:0c

Frame 18: 60 bytes on wire (480 bits), 60 bytes captured (480 bits) on interface 0
Ethernet II, Src: CadmusCo_99:78:0c (08:00:27:99:78:0c), Dst: CadmusCo_9c:1b:03 (08:00:27:9c:1b:03)
Address Resolution Protocol (reply)
